{
  "$schema": "http://json-schema.org/draft-07/schema#",
  "$id": "https://raw.githubusercontent.com/suirindo/agent-role-contracts/v0.1.0/schemas/task.schema.json",
  "title": "Agent Role Contracts task",
  "type": "object",
  "additionalProperties": false,
  "required": [
    "schema_version",
    "id",
    "type",
    "objective",
    "inputs",
    "acceptance_criteria"
  ],
  "properties": {
    "schema_version": {
      "type": "string",
      "const": "0.1"
    },
    "id": {
      "type": "string",
      "pattern": "^[a-z0-9][a-z0-9._-]*$",
      "minLength": 1,
      "maxLength": 96
    },
    "type": {
      "type": "string",
      "pattern": "^[a-z0-9][a-z0-9._-]*$",
      "minLength": 1,
      "maxLength": 96
    },
    "objective": {
      "type": "string",
      "minLength": 1,
      "pattern": "\\S"
    },
    "inputs": {
      "type": "object",
      "additionalProperties": {
        "type": [
          "string",
          "number",
          "boolean",
          "null"
        ]
      },
      "properties": {}
    },
    "acceptance_criteria": {
      "type": "array",
      "items": {
        "type": "string",
        "minLength": 1,
        "pattern": "\\S"
      },
      "minItems": 1,
      "maxItems": 256,
      "uniqueItems": true
    }
  }
}
