{
  "schema_version": "0.1",
  "id": "starter-change-1",
  "type": "code-change",
  "objective": "Change one file under src and send it to an independent reviewer.",
  "inputs": {
    "scope": "src/example.mjs"
  },
  "acceptance_criteria": [
    "The requested file stays inside declared write authority.",
    "The reviewer remains independent from the implementer."
  ]
}
